{
  "ecs_version": "1.0",
  "artifact_id": "urn:example:artifact:b",
  "artifact_version": "1",
  "origin": {
    "originator_id": "urn:example:originator:2",
    "origin_system": "Example Evidence System",
    "origin_node": "urn:example:node:a"
  },
  "evidence_profile": {
    "standard": "RES",
    "version": "1.0-draft",
    "conformance": [
      "RES-Core",
      "RES-Preservation"
    ]
  },
  "evidence_object_ref": "urn:example:res:record:b",
  "evidence_payload": {
    "summary": "example derived evidence payload"
  },
  "disclosure": "derived_evidence_only",
  "publication": "research",
  "integrity": {
    "algorithm": "sha256",
    "value": "1111111111111111111111111111111111111111111111111111111111111111",
    "scope": "artifact-envelope"
  },
  "provenance": [
    {
      "relation": "preserved-from",
      "target": "urn:example:res:record:a"
    }
  ],
  "review_state": "unreviewed",
  "challenge_refs": [],
  "supersedes": null,
  "extensions": {}
}
